project1/DATA/pokemon_gen-word_matrix200.csv

"pokemon_gen","code","flap","host","hunt","prefer","quick","rarely","bone","swimm","venomous","easily","toxic","plant","bolt","filthy","fossil","immobilize","intelligence","larger","lightning","lull","sludge","stone","venom","warning","boulder","weapon","female","gas","hot","muscle","throw","brain","flame","punch","burn","shock","timid","touch","bark","cool","elec­","mark","snout","soak","star","star­","storing","tricity","charge","hair","startle","swing","scent","electricity","hollow","depth","magnetic","silk","swarm","cell","cocoon","completely","magma","seas","spark","trigger","emotion","steal","forest","love","spring","teammate","dream","follow","gain","lead","mud","partner","faster","flower","sand","spirit","ago","cloak","honey","antenna","bud","capture","flotation","sac","cold","aura","flock","guard","impressive","magnetism","moon","pain","unit","vile","volcanic","deity","smell","sunlight","freeze","magazine","paranormal","expedition","journal","treasure","book","chain","hammer","oil","salt","fiery","list","mention","similarity","unknown","feather","beam","clad","dog","dorsal","dubious","fireball","future","king","mystery","physical","sighting","tea","temperament","apple","report","set","soul","metal","skin","internal","tuft","tusk","breath","crush","friend","snow","attacker","blizzard","crystal","fear","memory","wrestler","emit","pack","threaten","type","ears","hidden","inhabit","twig","bubble","ember","friendly","mane","pierce","predator","quill","restore","sword","trap","ultra","balloon","dangerous","intense","wormhole","disposition","guardian","home","hundred","iron","mound","overwhelm","poisonous","source","stomach","tear","top","unleash","violent","coal","cream","frigid","mine","particle","pound","reach","save","surroundings"
"generation-i",0.0152320594616029,0.0152320594616029,0.0152320594616029,0.0152320594616029,0.0152320594616029,0.0152320594616029,0.0152320594616029,0.0130335996254443,0.0114240445962022,0.0114240445962022,0.0104268797003555,0.0104268797003555,0.008432549908662,0.00761602973080145,0.00761602973080145,0.00761602973080145,0.00761602973080145,0.00761602973080145,0.00761602973080145,0.00761602973080145,0.00761602973080145,0.00761602973080145,0.00761602973080145,0.00761602973080145,0.00761602973080145,0.00571202229810109,0.00571202229810109,0.00521343985017773,0.00521343985017773,0.00521343985017773,0.00380801486540073,0.00380801486540073,0.002810849969554,0.002810849969554,0.00203738878648915,0.001405424984777,0,0,0,0,0,0,0,0,0,0,0,0,0,0,0,0,0,0,0,0,0,0,0,0,0,0,0,0,0,0,0,0,0,0,0,0,0,0,0,0,0,0,0,0,0,0,0,0,0,0,0,0,0,0,0,0,0,0,0,0,0,0,0,0,0,0,0,0,0,0,0,0,0,0,0,0,0,0,0,0,0,0,0,0,0,0,0,0,0,0,0,0,0,0,0,0,0,0,0,0,0,0,0,0,0,0,0,0,0,0,0,0,0,0,0,0,0,0,0,0,0,0,0,0,0,0,0,0,0,0,0,0,0,0,0,0,0,0,0,0,0,0,0,0,0,0,0,0,0,0,0,0,0,0,0,0,0,0,0,0,0,0,0,0
"generation-ii",0,0,0,0,0,0,0,0,0,0,0.0159442833580524,0,0,0,0,0,0,0,0,0,0,0,0,0,0,0,0,0,0,0.0159442833580524,0,0,0,0.00573095559163483,0,0,0.0232921333286525,0.0232921333286525,0.0232921333286525,0.0155280888857683,0.0155280888857683,0.0155280888857683,0.0155280888857683,0.0155280888857683,0.0155280888857683,0.0155280888857683,0.0155280888857683,0.0155280888857683,0.0155280888857683,0.0106295222387016,0.0106295222387016,0.0106295222387016,0.0106295222387016,0.00573095559163483,0.00429821669372612,0,0,0,0,0,0,0,0,0,0,0,0,0,0,0,0,0,0,0,0,0,0,0,0,0,0,0,0,0,0,0,0,0,0,0,0,0,0,0,0,0,0,0,0,0,0,0,0,0,0,0,0,0,0,0,0,0,0,0,0,0,0,0,0,0,0,0,0,0,0,0,0,0,0,0,0,0,0,0,0,0,0,0,0,0,0,0,0,0,0,0,0,0,0,0,0,0,0,0,0,0,0,0,0,0,0,0,0,0,0,0,0,0,0,0,0,0,0,0,0,0,0,0,0,0,0,0,0,0,0,0,0,0,0,0,0,0,0,0,0,0,0,0,0,0
"generation-iii",0,0,0,0,0,0,0,0,0,0,0,0,0,0,0,0,0,0,0,0,0,0,0,0,0,0.00207481074347141,0,0,0,0,0,0.00311221611520711,0.00459450547431348,0,0.00111007868725613,0.00114862636857837,0,0,0,0,0,0,0,0,0,0,0,0,0,0,0,0.00284056165585699,0,0,0.00114862636857837,0.0124488644608284,0.00829924297388563,0.00829924297388563,0.00829924297388563,0.00829924297388563,0.00622443223041422,0.00622443223041422,0.00622443223041422,0.00622443223041422,0.00622443223041422,0.00622443223041422,0.00622443223041422,0.00568112331171397,0.00568112331171397,0.00426084248378548,0.00426084248378548,0.00414962148694281,0.00414962148694281,0.00284056165585699,0.00284056165585699,0.00284056165585699,0.00284056165585699,0.00284056165585699,0.00284056165585699,0.00207481074347141,0.00191437728096395,0.00153150182477116,0.00111007868725613,0.00076575091238558,0,0,0,0,0,0,0,0,0,0,0,0,0,0,0,0,0,0,0,0,0,0,0,0,0,0,0,0,0,0,0,0,0,0,0,0,0,0,0,0,0,0,0,0,0,0,0,0,0,0,0,0,0,0,0,0,0,0,0,0,0,0,0,0,0,0,0,0,0,0,0,0,0,0,0,0,0,0,0,0,0,0,0,0,0,0,0,0,0,0,0,0,0,0,0,0,0,0,0,0,0,0,0,0,0,0,0,0,0,0,0,0,0,0,0,0
"generation-iv",0,0,0,0,0,0,0,0,0,0,0,0,0.00449268817848382,0,0,0,0,0,0,0,0,0,0,0,0,0,0,0,0,0,0,0,0,0,0,0,0,0,0,0,0,0,0,0,0,0,0,0,0,0,0,0,0,0,0.00224634408924191,0,0,0,0,0,0,0,0,0,0,0,0,0,0,0,0.0124992581449552,0,0,0,0,0,0,0,0,0,0.00336951613386286,0.00449268817848382,0.00488465372494836,0.00224634408924191,0.0243459786962462,0.0243459786962462,0.0182594840221846,0.0182594840221846,0.0182594840221846,0.0182594840221846,0.0182594840221846,0.0152162366851539,0.0121729893481231,0.0121729893481231,0.0121729893481231,0.0121729893481231,0.0121729893481231,0.0121729893481231,0.0121729893481231,0.0121729893481231,0.0121729893481231,0.0121729893481231,0.00833283876330346,0.00833283876330346,0.00833283876330346,0.00608649467406155,0,0,0,0,0,0,0,0,0,0,0,0,0,0,0,0,0,0,0,0,0,0,0,0,0,0,0,0,0,0,0,0,0,0,0,0,0,0,0,0,0,0,0,0,0,0,0,0,0,0,0,0,0,0,0,0,0,0,0,0,0,0,0,0,0,0,0,0,0,0,0,0,0,0,0,0,0,0,0,0,0,0,0,0,0,0,0,0,0,0,0,0,0,0
"generation-ix",0,0,0,0,0,0,0,0,0,0,0,0.00709470470177488,0,0,0,0,0,0,0,0.00345475562474248,0,0,0,0,0,0,0.00345475562474248,0,0,0,0.00345475562474248,0,0.0025500950195482,0.00382514252932231,0,0.0012750475097741,0,0,0,0,0,0,0,0,0,0,0,0,0,0,0,0,0,0.00382514252932231,0.00382514252932231,0,0,0,0,0,0,0,0,0,0,0,0,0,0.00709470470177488,0,0,0,0,0,0,0.00472980313451659,0,0,0,0,0.00191257126466115,0.00382514252932231,0,0.00191257126466115,0,0,0,0,0,0,0,0,0,0,0,0,0,0,0,0,0,0,0,0,0,0.00345475562474248,0.0345475562474248,0.0276380449979399,0.0172737781237124,0.0172737781237124,0.0172737781237124,0.0138190224989699,0.0138190224989699,0.0138190224989699,0.0138190224989699,0.0138190224989699,0.0103642668742274,0.0103642668742274,0.0103642668742274,0.0103642668742274,0.0103642668742274,0.00945960626903317,0.00690951124948497,0.00690951124948497,0.00690951124948497,0.00690951124948497,0.00690951124948497,0.00690951124948497,0.00690951124948497,0.00690951124948497,0.00690951124948497,0.00690951124948497,0.00690951124948497,0.00690951124948497,0.00690951124948497,0.00472980313451659,0.00472980313451659,0.00472980313451659,0.00472980313451659,0.00345475562474248,0.00345475562474248,0,0,0,0,0,0,0,0,0,0,0,0,0,0,0,0,0,0,0,0,0,0,0,0,0,0,0,0,0,0,0,0,0,0,0,0,0,0,0,0,0,0,0,0,0,0,0,0,0,0,0,0,0,0,0,0,0,0,0
"generation-v",0,0,0,0,0,0,0,0.00667489968983554,0,0,0,0,0.00239920182312523,0,0,0,0,0,0,0.00487549832249161,0,0,0,0,0,0.00487549832249161,0,0,0.00444993312655702,0,0,0,0.00359880273468785,0.00239920182312523,0.00173901380148556,0.00479840364625047,0,0,0,0,0,0,0,0,0,0,0,0,0,0.00444993312655702,0,0,0.00889986625311405,0,0.00299900227890654,0,0,0,0,0,0,0,0,0,0,0,0,0,0,0.00444993312655702,0,0,0,0.00667489968983554,0,0,0.00444993312655702,0,0,0.00325033221499441,0.00119960091156262,0,0.00173901380148556,0.00119960091156262,0,0,0,0,0,0,0,0,0,0,0,0,0,0,0,0,0,0,0,0,0.00444993312655702,0.00325033221499441,0,0,0,0,0,0,0,0,0,0,0,0,0,0,0,0,0,0,0,0,0,0,0,0,0,0,0,0,0,0,0,0,0,0,0.00487549832249161,0.0195019932899664,0.016251661074972,0.016251661074972,0.00975099664498322,0.00975099664498322,0.00975099664498322,0.00975099664498322,0.00650066442998882,0.00650066442998882,0.00650066442998882,0.00650066442998882,0.00650066442998882,0.00650066442998882,0.00487549832249161,0.00444993312655702,0.00444993312655702,0.00444993312655702,0,0,0,0,0,0,0,0,0,0,0,0,0,0,0,0,0,0,0,0,0,0,0,0,0,0,0,0,0,0,0,0,0,0,0,0,0,0,0,0,0,0
"generation-vi",0,0,0,0,0,0,0,0,0,0,0,0,0,0,0,0,0,0,0,0,0,0,0,0,0,0,0,0,0,0,0,0.01639719833833,0,0,0,0,0,0,0,0,0,0,0,0,0,0,0,0,0,0,0,0,0,0.0121034360629303,0,0,0,0,0,0,0,0,0,0,0,0,0,0,0,0,0,0,0,0,0,0,0,0,0,0,0.010590506555064,0,0.00438646764852328,0,0,0,0,0,0,0,0,0.008198599169165,0,0,0,0,0,0,0,0,0,0,0,0.0112244581848976,0,0,0,0,0,0,0,0,0,0,0,0,0,0,0,0,0,0.0168366872773464,0,0,0,0,0,0,0,0,0,0,0,0,0,0,0,0.0168366872773464,0,0.008198599169165,0,0,0,0,0,0,0,0,0,0,0,0,0,0,0.024595797507495,0,0.0112244581848976,0.0112244581848976,0.03279439667666,0.024595797507495,0.024595797507495,0.024595797507495,0.0168366872773464,0.01639719833833,0.01639719833833,0.01639719833833,0.01639719833833,0.01639719833833,0.01639719833833,0.01639719833833,0.01639719833833,0.01639719833833,0,0,0,0,0,0,0,0,0,0,0,0,0,0,0,0,0,0,0,0,0,0,0,0,0,0,0,0
"generation-vii",0,0,0,0,0,0,0,0,0,0,0,0,0,0,0,0,0,0,0,0,0,0,0,0,0,0,0.00617197914982084,0.00844987301559705,0,0,0,0,0,0,0.00330217227473101,0.0022778938657762,0,0,0,0,0,0,0,0,0,0,0,0,0,0,0,0,0,0,0,0,0,0,0,0,0,0,0,0,0,0,0,0,0,0,0,0,0,0,0,0,0,0.00844987301559705,0.00844987301559705,0,0.00569473466444051,0,0,0.0022778938657762,0,0,0,0,0,0,0,0,0,0,0,0,0,0,0,0,0,0,0.00844987301559705,0,0,0,0,0,0,0,0,0,0,0,0,0,0,0,0,0,0,0,0,0,0,0,0,0,0,0,0,0,0,0,0,0,0.00844987301559705,0,0,0,0,0,0,0,0,0,0,0,0,0,0,0,0,0,0,0,0,0,0,0,0,0,0.0126748095233956,0,0,0,0,0,0,0,0,0,0.0740637497978501,0.0185159374494625,0.0185159374494625,0.0185159374494625,0.0185159374494625,0.0123439582996417,0.0123439582996417,0.0123439582996417,0.0123439582996417,0.0123439582996417,0.0123439582996417,0.0123439582996417,0.0123439582996417,0.0123439582996417,0.0123439582996417,0.0123439582996417,0.0123439582996417,0.0123439582996417,0.0123439582996417,0,0,0,0,0,0,0,0,0
"generation-viii",0,0,0,0,0,0,0,0,0,0,0,0,0.00573771379398346,0,0,0,0,0,0,0,0,0,0,0,0,0,0,0,0,0,0.00518213343711372,0,0,0,0.00277257860802886,0.00191257126466115,0,0,0,0,0,0,0,0,0,0,0,0,0,0,0.0106420570526623,0,0,0.00573771379398346,0.00478142816165288,0,0,0,0,0,0,0,0,0,0,0,0,0.0106420570526623,0,0,0,0,0,0,0.0106420570526623,0,0,0,0,0.00518213343711372,0,0.00765028505864461,0.0041588679120433,0.00191257126466115,0,0,0,0,0,0,0,0.0103642668742274,0,0,0,0,0,0,0,0,0,0,0,0,0,0,0,0,0,0,0,0,0,0,0,0,0,0,0,0,0,0,0,0,0,0,0,0,0,0,0,0,0,0,0,0.0141894094035498,0,0,0.00709470470177488,0.00777320015567059,0.00518213343711372,0,0,0,0,0,0,0,0,0,0,0,0,0,0.00518213343711372,0.0106420570526623,0,0,0,0,0,0,0,0,0,0,0,0,0,0,0,0,0,0,0,0,0,0,0,0,0,0,0,0,0,0,0,0,0,0,0,0.0207285337484549,0.0103642668742274,0.0103642668742274,0.0103642668742274,0.0103642668742274,0.0103642668742274,0.0103642668742274,0.0103642668742274,0.0103642668742274

project1/SCRIPTS/pokemon_data_cleaning_for_hca.md

## # A tibble: 20 × 2

##    word_root  gen_mean_tfidf
    ##    <chr>               <dbl>
    ##  1 ultra              0.0741
    ##  2 magazine           0.0345
    ##  3 ears               0.0328
    ##  4 beasts             0.0309
    ##  5 paranormal         0.0276
    ##  6 beast              0.0247
    ##  7 hidden             0.0246
    ##  8 inhabit            0.0246
    ##  9 twig               0.0246
    ## 10 cloak              0.0243
    ## 11 honey              0.0243
    ## 12 shock              0.0233
    ## 13 timid              0.0233
    ## 14 touch              0.0233
    ## 15 coal               0.0207
    ## 16 internal           0.0195
    ## 17 creature           0.0189
    ## 18 asleep             0.0185
    ## 19 balloon            0.0185
    ## 20 dangerous          0.0185